{
  "schemaVersion": 1,
  "id": "java-backend-interview-taxonomy",
  "version": 1,
  "title": "Java 8-21 后端面试八股文大纲",
  "topics": [
    {"id":"java.language","name":"Java 语言基础","parentId":null,"kind":"domain","importance":5,"javaVersions":["8","11","17","21"],"keywords":["Java","语言基础"],"sourceRefs":["src-java-language","src-java-api"]},
    {"id":"java.language.oop","name":"面向对象与多态","parentId":"java.language","kind":"leaf","importance":5,"javaVersions":["8-21"],"keywords":["封装","继承","多态"],"sourceRefs":["src-java-language"]},
    {"id":"java.language.string","name":"String 与字符串池","parentId":"java.language","kind":"leaf","importance":5,"javaVersions":["8-21"],"keywords":["String","intern","不可变"],"sourceRefs":["src-java-language","src-java-api"]},
    {"id":"java.language.boxing","name":"基本类型与装箱拆箱","parentId":"java.language","kind":"leaf","importance":4,"javaVersions":["8-21"],"keywords":["boxing","Integer cache","primitive"],"sourceRefs":["src-java-language"]},
    {"id":"java.language.exceptions","name":"异常体系与处理","parentId":"java.language","kind":"leaf","importance":5,"javaVersions":["8-21"],"keywords":["checked exception","runtime exception","try-with-resources"],"sourceRefs":["src-java-language"]},
    {"id":"java.language.generics","name":"泛型与类型擦除","parentId":"java.language","kind":"leaf","importance":5,"javaVersions":["8-21"],"keywords":["泛型","类型擦除","PECS"],"sourceRefs":["src-java-language"]},
    {"id":"java.language.reflection","name":"反射机制","parentId":"java.language","kind":"leaf","importance":4,"javaVersions":["8-21"],"keywords":["reflection","Class","Method"],"sourceRefs":["src-java-api"]},
    {"id":"java.language.annotations","name":"注解与元注解","parentId":"java.language","kind":"leaf","importance":4,"javaVersions":["8-21"],"keywords":["annotation","retention","target"],"sourceRefs":["src-java-language","src-java-api"]},
    {"id":"java.language.features","name":"Java 8-21 语言特性","parentId":"java.language","kind":"leaf","importance":4,"javaVersions":["8","11","17","21"],"keywords":["lambda","record","sealed","pattern matching"],"sourceRefs":["src-java-language","src-openjdk-jeps"]},

    {"id":"java.collections","name":"集合框架","parentId":null,"kind":"domain","importance":5,"javaVersions":["8-21"],"keywords":["Collection","Map"],"sourceRefs":["src-java-api"]},
    {"id":"java.collections.arraylist","name":"ArrayList","parentId":"java.collections","kind":"leaf","importance":5,"javaVersions":["8-21"],"keywords":["ArrayList","扩容","数组"],"sourceRefs":["src-java-api"]},
    {"id":"java.collections.linkedlist","name":"LinkedList 与 Deque","parentId":"java.collections","kind":"leaf","importance":3,"javaVersions":["8-21"],"keywords":["LinkedList","Deque","链表"],"sourceRefs":["src-java-api"]},
    {"id":"java.collections.hashmap","name":"HashMap","parentId":"java.collections","kind":"leaf","importance":5,"javaVersions":["8-21"],"keywords":["HashMap","哈希","扩容","红黑树"],"sourceRefs":["src-java-api","src-openjdk-source"]},
    {"id":"java.collections.hashset","name":"HashSet 与 Set 语义","parentId":"java.collections","kind":"leaf","importance":4,"javaVersions":["8-21"],"keywords":["HashSet","equals","hashCode"],"sourceRefs":["src-java-api"]},
    {"id":"java.collections.treemap","name":"TreeMap 与排序集合","parentId":"java.collections","kind":"leaf","importance":4,"javaVersions":["8-21"],"keywords":["TreeMap","Comparator","红黑树"],"sourceRefs":["src-java-api"]},
    {"id":"java.collections.iterator","name":"迭代器与 fail-fast","parentId":"java.collections","kind":"leaf","importance":4,"javaVersions":["8-21"],"keywords":["Iterator","fail-fast","modCount"],"sourceRefs":["src-java-api"]},
    {"id":"java.collections.stream","name":"Stream API","parentId":"java.collections","kind":"leaf","importance":4,"javaVersions":["8-21"],"keywords":["Stream","lazy","parallel"],"sourceRefs":["src-java-api"]},
    {"id":"java.collections.concurrent","name":"并发集合","parentId":"java.collections","kind":"leaf","importance":5,"javaVersions":["8-21"],"keywords":["ConcurrentHashMap","CopyOnWriteArrayList","BlockingQueue"],"sourceRefs":["src-java-api"]},

    {"id":"java.jvm","name":"JVM","parentId":null,"kind":"domain","importance":5,"javaVersions":["8","11","17","21"],"keywords":["JVM","运行时"],"sourceRefs":["src-jvm-spec","src-openjdk-jeps"]},
    {"id":"java.jvm.memory","name":"运行时数据区","parentId":"java.jvm","kind":"leaf","importance":5,"javaVersions":["8-21"],"keywords":["heap","stack","metaspace"],"sourceRefs":["src-jvm-spec"]},
    {"id":"java.jvm.classloading","name":"类加载与双亲委派","parentId":"java.jvm","kind":"leaf","importance":5,"javaVersions":["8-21"],"keywords":["class loader","delegation","linking"],"sourceRefs":["src-jvm-spec"]},
    {"id":"java.jvm.bytecode","name":"字节码与执行引擎","parentId":"java.jvm","kind":"leaf","importance":4,"javaVersions":["8-21"],"keywords":["bytecode","operand stack","invoke"],"sourceRefs":["src-jvm-spec"]},
    {"id":"java.jvm.gc-basics","name":"垃圾回收基础","parentId":"java.jvm","kind":"leaf","importance":5,"javaVersions":["8-21"],"keywords":["GC roots","reachability","generation"],"sourceRefs":["src-jvm-spec"]},
    {"id":"java.jvm.collectors","name":"垃圾收集器","parentId":"java.jvm","kind":"leaf","importance":5,"javaVersions":["8","11","17","21"],"keywords":["G1","ZGC","CMS"],"sourceRefs":["src-openjdk-jeps"]},
    {"id":"java.jvm.references","name":"强软弱虚引用","parentId":"java.jvm","kind":"leaf","importance":4,"javaVersions":["8-21"],"keywords":["Reference","SoftReference","WeakReference"],"sourceRefs":["src-java-api"]},
    {"id":"java.jvm.jit","name":"JIT 与逃逸分析","parentId":"java.jvm","kind":"leaf","importance":4,"javaVersions":["8-21"],"keywords":["JIT","escape analysis","inlining"],"sourceRefs":["src-jvm-spec"]},
    {"id":"java.jvm.diagnostics","name":"JVM 诊断与调优","parentId":"java.jvm","kind":"leaf","importance":5,"javaVersions":["8-21"],"keywords":["jstack","jmap","JFR","GC log"],"sourceRefs":["src-java-api"]},

    {"id":"java.concurrency","name":"并发编程","parentId":null,"kind":"domain","importance":5,"javaVersions":["8","11","17","21"],"keywords":["concurrency","thread"],"sourceRefs":["src-java-language","src-java-api","src-openjdk-jeps"]},
    {"id":"java.concurrency.jmm","name":"Java 内存模型","parentId":"java.concurrency","kind":"leaf","importance":5,"javaVersions":["8-21"],"keywords":["JMM","happens-before","visibility"],"sourceRefs":["src-java-language"]},
    {"id":"java.concurrency.volatile","name":"volatile","parentId":"java.concurrency","kind":"leaf","importance":5,"javaVersions":["8-21"],"keywords":["volatile","visibility","ordering"],"sourceRefs":["src-java-language"]},
    {"id":"java.concurrency.synchronized","name":"synchronized 与监视器","parentId":"java.concurrency","kind":"leaf","importance":5,"javaVersions":["8-21"],"keywords":["synchronized","monitor","lock"],"sourceRefs":["src-java-language","src-jvm-spec"]},
    {"id":"java.concurrency.locks","name":"Lock 与 AQS","parentId":"java.concurrency","kind":"leaf","importance":5,"javaVersions":["8-21"],"keywords":["ReentrantLock","AQS","Condition"],"sourceRefs":["src-java-api"]},
    {"id":"java.concurrency.atomics","name":"CAS 与原子类","parentId":"java.concurrency","kind":"leaf","importance":5,"javaVersions":["8-21"],"keywords":["CAS","Atomic","ABA"],"sourceRefs":["src-java-api"]},
    {"id":"java.concurrency.threadpool","name":"线程池","parentId":"java.concurrency","kind":"leaf","importance":5,"javaVersions":["8-21"],"keywords":["ThreadPoolExecutor","queue","rejection"],"sourceRefs":["src-java-api"]},
    {"id":"java.concurrency.future","name":"Future 与 CompletableFuture","parentId":"java.concurrency","kind":"leaf","importance":4,"javaVersions":["8-21"],"keywords":["Future","CompletableFuture","async"],"sourceRefs":["src-java-api"]},
    {"id":"java.concurrency.virtual-threads","name":"虚拟线程","parentId":"java.concurrency","kind":"leaf","importance":4,"javaVersions":["21"],"keywords":["virtual thread","Loom","pinning"],"sourceRefs":["src-openjdk-jeps","src-java-api"]},

    {"id":"java.io","name":"I/O、NIO 与网络","parentId":null,"kind":"domain","importance":4,"javaVersions":["8-21"],"keywords":["IO","NIO","network"],"sourceRefs":["src-java-api"]},
    {"id":"java.io.streams","name":"字节流与字符流","parentId":"java.io","kind":"leaf","importance":4,"javaVersions":["8-21"],"keywords":["InputStream","Reader","buffer"],"sourceRefs":["src-java-api"]},
    {"id":"java.io.nio-buffer","name":"NIO Buffer","parentId":"java.io","kind":"leaf","importance":4,"javaVersions":["8-21"],"keywords":["Buffer","position","limit"],"sourceRefs":["src-java-api"]},
    {"id":"java.io.channel","name":"Channel 与零拷贝","parentId":"java.io","kind":"leaf","importance":4,"javaVersions":["8-21"],"keywords":["FileChannel","transferTo","zero copy"],"sourceRefs":["src-java-api"]},
    {"id":"java.io.selector","name":"Selector 与多路复用","parentId":"java.io","kind":"leaf","importance":5,"javaVersions":["8-21"],"keywords":["Selector","select","non-blocking"],"sourceRefs":["src-java-api"]},
    {"id":"java.io.files","name":"Path 与 Files","parentId":"java.io","kind":"leaf","importance":3,"javaVersions":["8-21"],"keywords":["Path","Files","file system"],"sourceRefs":["src-java-api"]},
    {"id":"java.io.serialization","name":"Java 序列化","parentId":"java.io","kind":"leaf","importance":3,"javaVersions":["8-21"],"keywords":["Serializable","serialVersionUID","transient"],"sourceRefs":["src-java-api"]},
    {"id":"java.io.socket","name":"Socket 网络编程","parentId":"java.io","kind":"leaf","importance":4,"javaVersions":["8-21"],"keywords":["Socket","TCP","UDP"],"sourceRefs":["src-java-api"]},
    {"id":"java.io.http-client","name":"HTTP Client","parentId":"java.io","kind":"leaf","importance":3,"javaVersions":["11-21"],"keywords":["HttpClient","HTTP/2","WebSocket"],"sourceRefs":["src-java-api"]},

    {"id":"spring","name":"Spring 生态","parentId":null,"kind":"domain","importance":5,"javaVersions":["8-21"],"keywords":["Spring","Spring Boot"],"sourceRefs":["src-spring-framework","src-spring-boot"]},